id,question,Option A,Option B,Option C,Option D,Option E,correct answer,difficulty
LC_001,JL is to LN as YN is to [?],ME,BQ,AL,AP,WL,D,1
LC_002,RL is to TN as JV is to [?],FQ,HT,MY,LT,LX,E,1
LC_003,BO is to DP as OK is to [?],QJ,PM,MJ,QL,RM,D,1
LC_004,RA is to TC as MF is to [?],VM,OH,PI,OD,KD,B,1
LC_005,BQ is to DS as ET is to [?],HW,CR,MA,GR,GV,E,1
LC_006,WJ is to YL as GE is to [?],JH,IC,IG,EC,UV,C,1
LC_007,ZO is to BQ as UE is to [?],XH,SC,WG,WC,EP,C,1
LC_008,RD is to SE as NB is to [?],FT,OA,MA,PD,OC,E,1
LC_009,VD is to XF as JW is to [?],LY,MZ,HU,LU,PT,A,1
LC_010,ZL is to BM as SF is to [?],VH,UG,QE,UE,TH,B,1
LC_011,QK is to RL as FV is to [?],GU,HX,EU,GW,LM,D,1
LC_012,BS is to DU as EC is to [?],GA,ZW,GE,HF,CA,C,1
LC_013,WK is to XM as CZ is to [?],EC,DX,EA,DB,BX,D,1
LC_014,RO is to TQ as LI is to [?],AM,NG,JG,NK,OL,D,1
LC_015,LP is to MR as IL is to [?],JJ,KO,JN,KM,HJ,C,1
LC_016,TA is to UB as HH is to [?],IG,JJ,BK,II,GG,D,1
LC_017,XF is to YG as AA is to [?],SR,BZ,BB,ZZ,CC,C,1
LC_018,KM is to MO as UJ is to [?],WH,XM,WL,SH,GS,C,1
LC_019,DO is to FQ as XA is to [?],AD,ZY,BH,VY,ZC,E,1
LC_020,ZX is to AY as TB is to [?],VD,UA,SA,AR,UC,E,1
LC_021,VN is to WP as SV is to [?],RT,UY,UW,TX,TT,D,1
LC_022,EN is to FO as MZ is to [?],NA,FS,NY,LY,OB,A,1
LC_023,ZI is to AK as AN is to [?],CO,BP,BL,CQ,ZL,B,1
LC_024,KA is to LB as LJ is to [?],BA,MI,NL,KI,MK,E,1
LC_025,FV is to HW as OJ is to [?],QK,PL,RL,QI,MI,A,1
LC_026,ZO is to BQ as ZP is to [?],XN,CS,BG,BR,BN,D,1
LC_027,HZ is to IA as LN is to [?],MO,XJ,KM,NP,MM,A,1
LC_028,NO is to OP as TC is to [?],UD,VE,UB,PP,SB,A,1
LC_029,AI is to BJ as TJ is to [?],AW,UK,VL,UI,SI,B,1
LC_030,LJ is to MK as UC is to [?],VB,PT,TB,WE,VD,E,1
LC_031,AX is to CZ as LG is to [?],NI,NE,ZD,JE,OJ,A,1
LC_032,XX is to ZZ as QB is to [?],SZ,QM,OZ,SD,TE,D,1
LC_033,UE is to VF as TN is to [?],VP,UO,JT,UM,SM,B,1
LC_034,KS is to MT as WX is to [?],ZZ,UW,YY,XZ,YW,C,1
LC_035,JF is to LH as BV is to [?],MI,ZT,DT,DX,EY,D,1
LC_036,MS is to NT as JY is to [?],KX,KZ,IX,LA,KA,B,1
LC_037,RD is to TF as WT is to [?],UR,YR,ZW,YV,SX,D,1
LC_038,WQ is to YS as DO is to [?],FM,FQ,BM,GR,HH,B,1
LC_039,YF is to ZG as SR is to [?],FO,RQ,TS,TQ,UT,C,1
LC_040,HS is to JU as UZ is to [?],SX,UH,WB,WX,XC,C,1
LC_041,WT is to XU as VL is to [?],UK,XN,RW,WM,WK,D,2
LC_042,LK is to OM as NE is to [?],QG,RH,KC,PH,QC,A,2
LC_043,IG is to KF as OX is to [?],QW,NZ,QY,MY,RX,A,2
LC_044,ZM is to CO as ZL is to [?],DO,CN,CJ,WJ,BO,B,2
LC_045,WC is to ZE as PC is to [?],MA,TF,SA,SE,RF,D,2
LC_046,VK is to YN as BI is to [?],EL,XF,EF,YF,FM,A,2
LC_047,NK is to MJ as XI is to [?],WH,XI,YJ,DQ,WJ,A,2
LC_048,OZ is to PX as LU is to [?],MW,JV,KW,MS,NT,D,2
LC_049,RG is to QI as UM is to [?],TK,TO,VK,WL,UP,B,2
LC_050,EZ is to HY as KN is to [?],JQ,NM,NO,ON,HO,B,2
LC_051,GQ is to EP as ZO is to [?],YM,BP,XP,XN,YO,D,2
LC_052,CH is to AJ as QE is to [?],TZ,OC,PH,OG,SC,D,2
LC_053,EA is to DB as DC is to [?],DE,CB,SW,CD,EB,D,2
LC_054,FM is to EN as LS is to [?],CN,KT,LU,KR,MR,B,2
LC_055,TC is to UE as MC is to [?],OF,NE,OD,NA,LA,B,2
LC_056,CT is to DS as WU is to [?],XV,OG,XT,VV,YU,C,2
LC_057,XA is to YB as XM is to [?],ZO,YL,PL,WL,YN,E,2
LC_058,TO is to WM as MW is to [?],PY,QV,JY,PU,KZ,D,2
LC_059,BO is to ZN as PA is to [?],OY,RB,NB,NZ,OA,D,2
LC_060,AN is to ZP as YW is to [?],YZ,XU,ZU,XY,AV,D,2
LC_061,GI is to JJ as JV is to [?],KY,MW,NX,GU,MU,B,2
LC_062,XC is to WD as NX is to [?],JP,OW,MW,NZ,MY,E,2
LC_063,EY is to GA as DQ is to [?],RN,BO,FO,FS,GT,D,2
LC_064,KU is to NS as OE is to [?],MH,SD,RG,RC,LG,D,2
LC_065,FE is to GG as KS is to [?],LU,MV,JQ,LQ,MT,A,2
LC_066,CQ is to ES as XL is to [?],AO,ZJ,ZN,VJ,FW,C,2
LC_067,PX is to NW as KI is to [?],JI,JG,IJ,IH,MJ,D,2
LC_068,UO is to SP as QQ is to [?],SP,PS,OR,RO,OP,C,2
LC_069,IQ is to JS as UF is to [?],WI,WG,VD,TD,VH,E,2
LC_070,HG is to IE as AR is to [?],CQ,YS,ZT,BP,BT,D,2
LC_071,PO is to OQ as VE is to [?],UG,WC,UC,XD,VH,A,2
LC_072,YA is to XB as AY is to [?],ZX,ZZ,AA,BX,VT,B,2
LC_073,OB is to NE as TH is to [?],SK,SE,TL,UE,WG,A,2
LC_074,QB is to OZ as CK is to [?],PD,AM,BJ,AI,EM,D,2
LC_075,HA is to JZ as BW is to [?],ZX,DX,DV,AY,EW,C,2
LC_076,FA is to GD as OO is to [?],PL,PR,RP,NL,QS,B,2
LC_077,PU is to OW as CJ is to [?],CM,DH,BH,EI,BL,E,2
LC_078,GS is to JQ as PE is to [?],MG,SC,SG,TD,NH,B,2
LC_079,FJ is to GM as JG is to [?],MH,KD,LK,ID,KJ,E,2
LC_080,EP is to GN as QT is to [?],OV,SR,TS,SV,II,B,2
LC_081,VU is to SV as XQ is to [?],AP,UR,UP,YN,VS,B,3
LC_082,VE is to ZC as QY is to [?],MA,OC,UA,VX,UW,E,3
LC_083,WC is to ZD as YV is to [?],BW,CX,ZY,BU,VU,A,3
LC_084,NT is to JU as XR is to [?],UT,TQ,YN,TS,BQ,D,3
LC_085,MY is to PA as LX is to [?],OZ,NA,OV,PA,IV,A,3
LC_086,NU is to RV as UX is to [?],ZZ,YW,QW,YY,VB,D,3
LC_087,YT is to VU as FM is to [?],IL,DO,GJ,CL,CN,E,3
LC_088,YE is to CD as AQ is to [?],ZU,ER,WR,EP,FQ,D,3
LC_089,FA is to IC as MK is to [?],ON,PM,JI,QN,PI,B,3
LC_090,PQ is to MP as QQ is to [?],OQ,TR,NR,PN,NP,E,3
LC_091,FR is to CP as BS is to [?],YU,ZP,ZR,YQ,EU,D,3
LC_092,NT is to RU as DM is to [?],ZL,EQ,HL,IO,HN,E,3
LC_093,BK is to YM as NO is to [?],LR,QM,KM,KQ,PL,D,3
LC_094,OB is to KA as YZ is to [?],CA,UY,UA,VZ,XV,B,3
LC_095,FI is to BK as ZG is to [?],VE,BC,VI,DE,WJ,C,3
LC_096,GP is to KQ as KT is to [?],OU,LX,GS,PV,OS,A,3
LC_097,WH is to TG as QG is to [?],PD,NF,OG,NH,TH,B,3
LC_098,WP is to SO as OB is to [?],LB,KC,KA,SC,NX,C,3
LC_099,RE is to UC as FR is to [?],JQ,IP,IT,CT,DU,B,3
LC_100,DJ is to GH as AH is to [?],EG,YK,DF,XJ,DJ,C,3
LC_101,CL is to ZM as TG is to [?],RI,QF,QH,WF,UD,C,3
LC_102,HU is to LS as YO is to [?],CQ,UQ,DN,WS,CM,E,3
LC_103,PH is to MI as GZ is to [?],DY,DA,HW,EB,JY,B,3
LC_104,YN is to BP as UV is to [?],RT,XT,WY,YY,XX,E,3
LC_105,UT is to QU as VA is to [?],ZZ,RB,SC,WW,RZ,B,3
LC_106,SO is to VP as VF is to [?],SE,YG,ZH,YE,WI,B,3
LC_107,KJ is to OH as LI is to [?],PG,JM,HK,PK,QH,A,3
LC_108,GD is to CC as LQ is to [?],KM,PR,HR,HP,IQ,D,3
LC_109,VR is to ZP as AP is to [?],FO,YT,WR,EN,ER,D,3
LC_110,SR is to PQ as ZG is to [?],WH,WF,YD,XG,CH,B,3
LC_111,ML is to IJ as GG is to [?],CI,KI,DF,CE,EC,D,3
LC_112,KL is to GM as MS is to [?],IR,JU,QR,IT,NO,D,3
LC_113,LF is to PH as WO is to [?],AM,AQ,SM,BR,YS,B,3
LC_114,BU is to XS as AR is to [?],WT,XQ,ET,YN,WP,E,3
LC_115,JS is to FU as WK is to [?],YG,SM,AI,SI,TN,B,3
LC_116,TZ is to XX as YN is to [?],CL,UP,CP,WR,DM,A,3
LC_117,KX is to GW as MK is to [?],IJ,JK,IL,QL,LG,A,3
LC_118,CK is to GI as RH is to [?],WG,VF,PL,VJ,NJ,B,3
LC_119,OP is to LR as AJ is to [?],XL,CG,YM,DH,XH,A,3
LC_120,PK is to MJ as HU is to [?],FU,ET,EV,GR,KV,B,3
LC_121,RY is to LF as KO is to [?],RI,QH,FW,EV,EH,D,4
LC_122,WE is to DZ as UG is to [?],NL,BL,PN,CC,BB,E,4
LC_123,FM is to MT as KZ is to [?],RG,YL,RS,DS,SH,A,4
LC_124,PD is to WL as HF is to [?],PM,AX,OX,PO,ON,E,4
LC_125,YK is to EF as JU is to [?],PZ,PP,EA,QQ,DZ,B,4
LC_126,YZ is to EH as KV is to [?],QD,EN,QN,SB,RE,A,4
LC_127,VE is to PY as GF is to [?],AZ,ML,BA,AL,IE,A,4
LC_128,LW is to TR as JR is to [?],RW,BW,SN,RM,EZ,D,4
LC_129,TE is to YZ as YH is to [?],DM,DC,EH,TM,ED,B,4
LC_130,MJ is to GE as VF is to [?],PK,PA,BK,QZ,QB,B,4
LC_131,XA is to SF as EM is to [?],UI,ZH,JH,ZR,AS,D,4
LC_132,IV is to DA as BI is to [?],WD,GD,WN,XO,JG,C,4
LC_133,KB is to EV as KI is to [?],CG,EC,EO,QO,FD,B,4
LC_134,TE is to AL as LZ is to [?],VQ,SS,TH,SG,ES,D,4
LC_135,SH is to NO as LC is to [?],GV,HK,GJ,QV,SX,C,4
LC_136,ZW is to EE as DY is to [?],YQ,LD,JH,IQ,IG,E,4
LC_137,ZB is to FH as BM is to [?],HG,WH,HS,VG,IT,C,4
LC_138,UU is to OO as QV is to [?],RX,KP,LQ,KB,WB,B,4
LC_139,JG is to PA as QN is to [?],WT,XI,KT,PN,WH,E,4
LC_140,YS is to TA as FX is to [?],AF,AP,BG,KP,NS,A,4
LC_141,AM is to US as OQ is to [?],JX,IK,IW,UK,GM,C,4
LC_142,XO is to FV as KM is to [?],ST,TU,RU,CF,SF,A,4
LC_143,TJ is to ZO as TU is to [?],YA,ZZ,AA,NP,ZP,B,4
LC_144,IX is to OF as OP is to [?],UH,VY,UX,IH,WV,C,4
LC_145,TY is to OT as PX is to [?],LT,UC,KC,BM,KS,E,4
LC_146,FL is to ZR as KU is to [?],GI,FB,QO,EO,EA,E,4
LC_147,HE is to CJ as ZA is to [?],VG,UF,UV,EV,NG,B,4
LC_148,UW is to AE as RK is to [?],LC,XS,YT,ZQ,XC,B,4
LC_149,FV is to ZB as MH is to [?],GN,GB,SB,ME,HO,A,4
LC_150,AJ is to VQ as AL is to [?],FE,VS,VE,HG,WT,B,4
LC_151,ZN is to HT as BA is to [?],HI,TU,JU,JG,KH,D,4
LC_152,OL is to UF as ZS is to [?],GN,PM,TY,FM,FY,D,4
LC_153,FN is to LS as BY is to [?],VT,HT,HD,GE,IE,C,4
LC_154,YR is to EZ as WA is to [?],EG,CS,CI,DJ,QS,C,4
LC_155,XU is to SB as TU is to [?],ON,AP,OB,PC,YN,C,4
LC_156,PB is to JW as FC is to [?],ZH,AW,AY,ZX,LH,D,4
LC_157,DY is to KF as OV is to [?],WD,JA,VC,HO,VO,C,4
LC_158,WB is to CH as KN is to [?],QH,RU,QT,JT,EH,C,4
LC_159,EV is to JC as IS is to [?],NL,NZ,OA,DL,PX,B,4
LC_160,WV is to EA as GK is to [?],PQ,YF,OF,OP,LS,D,4
LC_161,NL is to ZI as PC is to [?],MO,BZ,CA,DF,BF,B,5
LC_162,YT is to JR as UE is to [?],FG,FC,GD,JG,SP,B,5
LC_163,MC is to YA as AX is to [?],NW,OZ,YJ,MV,MZ,D,5
LC_164,HU is to XS as IC is to [?],ZB,GS,YA,SE,YE,C,5
LC_165,DG is to OL as QC is to [?],BH,FX,BX,CI,VN,A,5
LC_166,WQ is to IN as HD is to [?],UB,TA,VG,EP,TG,B,5
LC_167,ZT is to KB as OG is to [?],AP,ZY,ZO,DY,WR,C,5
LC_168,GZ is to QX as CS is to [?],SU,NR,MU,MQ,AC,D,5
LC_169,WX is to MF as MW is to [?],CE,UM,WO,CO,DF,A,5
LC_170,ZM is to PU as GN is to [?],OD,WF,XW,WV,QF,D,5
LC_171,DM is to TR as IX is to [?],ZD,YC,SS,NN,YS,B,5
LC_172,ZV is to KS as FB is to [?],QE,QY,CM,UE,RZ,B,5
LC_173,WC is to JK as FA is to [?],NN,SA,SS,TJ,SI,E,5
LC_174,WV is to JT as EG is to [?],SF,CT,RE,RI,JF,C,5
LC_175,OM is to YK as DR is to [?],BB,TT,NP,NT,OQ,C,5
LC_176,IU is to US as SU is to [?],ES,QG,GW,EW,FT,A,5
LC_177,LR is to BP as YT is to [?],OV,IV,OR,WJ,PS,C,5
LC_178,WD is to JL as MY is to [?],ZG,ZQ,AN,UL,AH,A,5
LC_179,DC is to OH as EJ is to [?],TE,PO,PE,JU,QP,B,5
LC_180,OI is to EF as ZF is to [?],PI,JI,PC,QD,WV,C,5
LC_181,YS is to JQ as GA is to [?],RY,EL,SZ,VC,RC,A,5
LC_182,DN is to QS as JL is to [?],WQ,OY,XR,RP,WG,A,5
LC_183,RX is to CU as QG is to [?],FJ,CE,BJ,NR,BD,E,5
LC_184,YN is to KS as AE is to [?],FQ,OZ,NK,MZ,MJ,E,5
LC_185,AN is to KS as FM is to [?],VH,PH,QS,KW,PR,E,5
LC_186,UN is to EL as IP is to [?],YR,SR,GZ,TO,SN,E,5
LC_187,RN is to CL as TE is to [?],IG,RP,EG,EC,FD,D,5
LC_188,YH is to LE as VC is to [?],IZ,SP,UC,IF,JA,A,5
LC_189,ZU is to KS as CA is to [?],NY,OZ,NC,RC,AL,A,5
LC_190,FZ is to RE as EG is to [?],QL,QB,JS,SB,RM,A,5
LC_191,UG is to KL as PD is to [?],FY,ZY,UT,FI,GJ,D,5
LC_192,AG is to ND as ZB is to [?],NZ,IX,WO,MY,ME,D,5
LC_193,CT is to OY as LV is to [?],ZQ,XQ,XA,QH,YB,C,5
LC_194,DG is to TL as GD is to [?],WY,XJ,WI,QY,LT,C,5
LC_195,YV is to JA as QV is to [?],CB,BA,BQ,FQ,VG,B,5
LC_196,SZ is to CH as OP is to [?],ZY,YX,YH,WZ,EH,B,5
LC_197,GW is to WB as AF is to [?],QA,FV,RL,KA,QK,E,5
LC_198,OW is to ZE as JP is to [?],VY,UX,RA,UH,YH,B,5
LC_199,GU is to WR as EX is to [?],UA,OA,UU,VV,BN,C,5
LC_200,IH is to UM as NR is to [?],AX,BM,ZM,ZW,SD,D,5
LC_201,VS is to WT as GU is to [?],FT,IW,HV,HT,PQ,C,1
LC_202,RY is to TA as QI is to [?],OG,TG,SG,TL,SK,E,1
LC_203,AU is to CW as NF is to [?],PH,OZ,QI,PD,LD,A,1
LC_204,HY is to JA as KQ is to [?],MS,VS,IO,MO,NT,A,1
LC_205,FN is to GP as YW is to [?],XU,ZU,AX,ZY,AZ,D,1
LC_206,BE is to DG as QQ is to [?],NE,OO,TT,SS,SO,D,1
LC_207,KJ is to ML as XG is to [?],ZE,VE,RM,AJ,ZI,E,1
LC_208,BE is to DF as UF is to [?],SE,VH,XH,WG,WE,D,1
LC_209,AQ is to CS as LZ is to [?],OC,JX,NB,NX,XV,C,1
LC_210,AA is to BB as ER is to [?],FS,GT,DQ,FQ,OM,A,1
LC_211,FS is to GU as HV is to [?],IT,JW,IX,GT,JY,C,1
LC_212,VP is to XR as XJ is to [?],VH,ZL,TJ,AM,ZH,B,1
LC_213,UB is to WD as NU is to [?],PW,LS,QX,YG,PS,A,1
LC_214,GW is to IX as IY is to [?],KX,JA,KZ,LA,GX,C,1
LC_215,XZ is to YA as AJ is to [?],BK,DS,ZI,BI,CL,A,1
LC_216,XA is to ZC as AA is to [?],CC,IN,DD,YY,CY,A,1
LC_217,OO is to QQ as OA is to [?],QC,MY,GZ,QY,RD,A,1
LC_218,ZY is to AZ as YV is to [?],AX,CB,ZU,ZW,XU,D,1
LC_219,BE is to DF as ZZ is to [?],BY,CB,XY,BA,AB,D,1
LC_220,QL is to RM as DJ is to [?],FL,EI,PB,CI,EK,E,1
LC_221,HM is to IN as US is to [?],VR,TR,VT,AY,WU,C,1
LC_222,CZ is to EB as NK is to [?],PM,YU,LI,PI,QN,A,1
LC_223,YH is to AI as YD is to [?],BF,AE,ZF,AC,WC,B,1
LC_224,QB is to RD as GK is to [?],IN,HI,HM,IL,FI,C,1
LC_225,MH is to NJ as TB is to [?],UZ,UD,SZ,VC,VE,B,1
LC_226,OR is to PS as FL is to [?],IQ,HN,EK,GM,GK,D,1
LC_227,CB is to EC as LX is to [?],NY,JW,MZ,OZ,NW,A,1
LC_228,QF is to RH as GZ is to [?],HB,FX,IA,IC,HX,A,1
LC_229,II is to KK as AL is to [?],YJ,CJ,DO,GA,CN,E,1
LC_230,VH is to WI as RZ is to [?],QY,QA,TB,SY,SA,E,1
LC_231,KL is to MN as NO is to [?],PF,PM,LM,QR,PQ,E,1
LC_232,IK is to KM as EC is to [?],GA,CA,GE,HF,EU,C,1
LC_233,GU is to IW as BG is to [?],DI,GT,DE,ZE,EJ,A,1
LC_234,LP is to NR as BX is to [?],DV,UF,ZV,DZ,EA,D,1
LC_235,AO is to BP as TU is to [?],WJ,VW,ST,UT,UV,E,1
LC_236,WY is to YA as ZT is to [?],XR,BR,TU,BV,CW,D,1
LC_237,MT is to NU as PX is to [?],OW,EZ,QY,RZ,QW,C,1
LC_238,SZ is to UB as GT is to [?],IR,ER,IV,JW,QW,C,1
LC_239,CL is to DM as BH is to [?],CG,KJ,AG,DJ,CI,E,1
LC_240,LK is to NM as QX is to [?],OV,SF,SV,TA,SZ,E,1
LC_241,RV is to SY as UP is to [?],WT,VM,TM,VS,XQ,D,2
LC_242,CV is to DT as MU is to [?],KV,OT,NS,NW,LW,C,2
LC_243,MA is to OZ as SJ is to [?],QK,RL,UK,VJ,UI,E,2
LC_244,IA is to JY as MN is to [?],OM,LP,NL,KO,NP,C,2
LC_245,LN is to OP as KK is to [?],NI,ON,NM,HI,MN,C,2
LC_246,ES is to CR as PG is to [?],RH,OG,NH,NF,OE,D,2
LC_247,BD is to DG as ZP is to [?],CT,BS,BM,CR,XM,B,2
LC_248,ED is to FB as BB is to [?],ZC,DA,CD,CZ,AD,D,2
LC_249,ET is to DV as AU is to [?],BS,CT,ZS,AX,ZW,E,2
LC_250,HS is to JV as PN is to [?],SP,NK,SR,RQ,RK,D,2
LC_251,RT is to UR as AO is to [?],XQ,DM,YR,DQ,EN,B,2
LC_252,KS is to IR as YG is to [?],AH,XE,WF,WH,XG,C,2
LC_253,LP is to NR as LO is to [?],JM,NQ,NM,OR,UG,B,2
LC_254,TT is to WS as TD is to [?],WE,SG,XD,WC,QE,D,2
LC_255,QL is to TN as XF is to [?],BI,AD,AH,ZI,UD,C,2
LC_256,IB is to JD as HF is to [?],JI,GD,IH,JG,ID,C,2
LC_257,JO is to MN as DB is to [?],GA,HB,GC,AC,CE,A,2
LC_258,XK is to WI as PZ is to [?],PY,OX,NY,QB,OB,B,2
LC_259,FD is to HF as ZF is to [?],BH,XD,CI,BD,VW,A,2
LC_260,EO is to CR as QH is to [?],OK,TF,PL,OE,SE,A,2
LC_261,LT is to MV as GR is to [?],HT,IU,IS,HP,FP,A,2
LC_262,IF is to GD as NM is to [?],LO,ML,LK,GQ,PO,C,2
LC_263,MW is to PX as QR is to [?],UT,NQ,RU,TS,TQ,D,2
LC_264,LQ is to JO as RO is to [?],JL,PQ,TQ,PM,QN,D,2
LC_265,QL is to PJ as HL is to [?],HK,GJ,FK,GN,IN,B,2
LC_266,ES is to FV as VA is to [?],UX,XE,WD,YB,WX,C,2
LC_267,QS is to PT as GE is to [?],FD,GG,FF,OD,HD,C,2
LC_268,AU is to DT as HD is to [?],GG,KC,KE,EE,LD,B,2
LC_269,LH is to MJ as NM is to [?],PP,MK,PN,OO,OK,D,2
LC_270,RA is to PY as VV is to [?],TT,TX,UU,IC,XX,A,2
LC_271,GV is to FX as CZ is to [?],BX,DX,CC,BB,EY,D,2
LC_272,YT is to WV as QH is to [?],RR,SF,OF,PK,OJ,E,2
LC_273,VH is to YK as ED is to [?],HG,HA,AU,IH,BA,A,2
LC_274,EZ is to FX as ZK is to [?],YM,AM,BJ,XL,AI,E,2
LC_275,SF is to QE as CC is to [?],ED,BC,AD,AB,BA,D,2
LC_276,MI is to NH as ID is to [?],KD,WA,HE,JC,JE,D,2
LC_277,BW is to AY as GN is to [?],GQ,IM,HL,FP,FL,D,2
LC_278,QT is to SW as XM is to [?],ZP,ZJ,AO,AQ,VJ,A,2
LC_279,GH is to EK as RP is to [?],UN,QT,PS,PM,TM,C,2
LC_280,BD is to EB as SR is to [?],PT,WQ,VP,QU,VT,C,2
LC_281,MS is to PR as JN is to [?],GO,MM,NN,IQ,MO,B,3
LC_282,TR is to WT as OF is to [?],RD,QI,LD,RH,SI,D,3
LC_283,BU is to EW as PJ is to [?],RM,SL,SH,TM,MH,B,3
LC_284,EB is to HD as VN is to [?],YP,XQ,SL,YL,ZQ,A,3
LC_285,XX is to TY as YU is to [?],CT,UV,UT,VW,ZQ,B,3
LC_286,XC is to UD as UE is to [?],SG,VB,XD,RD,RF,E,3
LC_287,IN is to LM as QI is to [?],TH,PL,UI,NJ,TJ,A,3
LC_288,HS is to DR as TO is to [?],XP,PP,QO,PN,SK,D,3
LC_289,VL is to SJ as HH is to [?],FG,FE,KJ,EJ,EF,E,3
LC_290,AQ is to WO as ZD is to [?],VF,VB,XZ,DF,WC,B,3
LC_291,WR is to ZT as HN is to [?],JQ,KP,KL,LQ,EL,B,3
LC_292,EH is to HJ as WP is to [?],YS,AS,ZN,TN,ZR,E,3
LC_293,HA is to EZ as UX is to [?],RW,XY,RY,TU,SX,A,3
LC_294,EH is to HG as LY is to [?],PY,IZ,KB,OX,OZ,D,3
LC_295,HU is to LT as JU is to [?],OU,FV,NV,IY,NT,E,3
LC_296,NC is to JD as DW is to [?],ES,ZV,ZX,AY,HV,C,3
LC_297,ZZ is to CB as CF is to [?],FH,FD,ZD,EI,GI,A,3
LC_298,CM is to FO as SZ is to [?],VX,PX,WC,UC,VB,E,3
LC_299,ZD is to WF as EP is to [?],BN,GM,CS,HN,BR,E,3
LC_300,YM is to VK as TW is to [?],QU,QY,RV,WY,RT,A,3
LC_301,NV is to JW as YO is to [?],UN,ZK,UP,CN,VQ,C,3
LC_302,GC is to DD as WQ is to [?],US,XN,TR,ZP,TP,C,3
LC_303,QP is to MR as YJ is to [?],CH,UH,AF,UL,VM,D,3
LC_304,NT is to QU as ZU is to [?],CV,DW,AX,CT,WT,A,3
LC_305,HL is to LK as DB is to [?],CF,IB,HC,HA,ZC,D,3
LC_306,IJ is to EK as ZW is to [?],DV,VX,WY,VV,AS,B,3
LC_307,ND is to RF as OJ is to [?],QN,TM,SL,SH,KH,C,3
LC_308,BU is to FW as PN is to [?],LL,TP,UQ,RR,TL,B,3
LC_309,IA is to EZ as AM is to [?],ZI,EN,WN,WL,XM,D,3
LC_310,TL is to WN as TR is to [?],WT,QP,VU,WP,XU,A,3
LC_311,RP is to NR as HH is to [?],EK,DF,JD,LF,DJ,E,3
LC_312,ZW is to WU as UY is to [?],RA,RW,SX,SV,XA,B,3
LC_313,JS is to NQ as UD is to [?],YB,SH,YF,QF,ZC,A,3
LC_314,BA is to YY as TQ is to [?],WS,RP,QO,RN,QS,C,3
LC_315,ZH is to CJ as NE is to [?],QG,KC,PH,RH,QC,A,3
LC_316,DS is to ZR as XX is to [?],BY,UX,TW,WT,TY,C,3
LC_317,DF is to ZD as ZA is to [?],DC,VC,XW,WZ,VY,E,3
LC_318,GZ is to DY as DR is to [?],CO,BR,AQ,AS,GS,C,3
LC_319,JL is to FN as GG is to [?],CE,IC,CI,KE,DJ,C,3
LC_320,TW is to QY as WC is to [?],TE,YZ,ZA,TA,UF,A,3
LC_321,EV is to LD as ZR is to [?],GZ,HA,SJ,GJ,HY,A,4
LC_322,FF is to LM as NM is to [?],TF,HF,UU,TT,US,D,4
LC_323,KL is to SG as GJ is to [?],BR,PF,OE,OO,YO,C,4
LC_324,VK is to QQ as YY is to [?],ET,TS,TE,UF,DS,C,4
LC_325,LB is to QV as RT is to [?],XO,LY,WN,MZ,WZ,C,4
LC_326,ZD is to HI as MS is to [?],VY,EN,RA,UX,UN,D,4
LC_327,QM is to KH as QE is to [?],LY,KJ,WJ,LA,KZ,E,4
LC_328,YN is to DI as ZN is to [?],FJ,ES,EI,US,QN,C,4
LC_329,CR is to IW as TX is to [?],YD,AD,ZC,ZS,NS,C,4
LC_330,MT is to GZ as WB is to [?],CV,QP,RI,QV,QH,E,4
LC_331,OS is to WY as UO is to [?],AW,MI,DV,CI,CU,E,4
LC_332,LO is to GW as PE is to [?],LN,XZ,KM,UW,KW,C,4
LC_333,WM is to DH as II is to [?],PD,PN,DP,BN,QE,A,4
LC_334,RO is to XU as YE is to [?],JZ,SY,EK,FL,EY,C,4
LC_335,VL is to BQ as CE is to [?],WZ,IJ,HK,JK,IZ,B,4
LC_336,QM is to VU as VK is to [?],DP,AS,QC,BT,AC,B,4
LC_337,NZ is to VG as IX is to [?],PF,QE,RF,AQ,QQ,B,4
LC_338,JG is to DO as ZH is to [?],HB,TZ,FZ,UQ,TP,E,4
LC_339,ZN is to EH as EX is to [?],KS,JR,ZD,JD,YC,B,4
LC_340,NI is to TD as GJ is to [?],BP,NF,ME,MO,AO,C,4
LC_341,JB is to EI as GX is to [?],NS,CF,BE,BQ,LQ,C,4
LC_342,UY is to ZE as AQ is to [?],VK,GV,GX,FW,FK,D,4
LC_343,CO is to JU as IF is to [?],PL,PZ,OM,QM,BZ,A,4
LC_344,EZ is to KG as XB is to [?],EJ,RU,DU,DI,EH,D,4
LC_345,EY is to ZE as LO is to [?],QI,GI,GU,HV,RJ,C,4
LC_346,AL is to IQ as XG is to [?],FB,CO,FL,GM,PB,C,4
LC_347,DY is to JF as KY is to [?],QR,ER,RE,RG,QF,E,4
LC_348,ZE is to FY as TZ is to [?],NF,AU,ZF,FL,ZT,E,4
LC_349,VV is to QA as HC is to [?],IB,CH,DI,MX,CX,B,4
LC_350,AD is to UY as SL is to [?],NF,MQ,MG,YQ,NH,C,4
LC_351,QY is to LE as OX is to [?],KE,TR,JR,JD,US,D,4
LC_352,ZN is to US as RO is to [?],NU,WJ,MJ,MT,SZ,D,4
LC_353,NO is to SU as JU is to [?],OO,EO,OA,PB,PZ,C,4
LC_354,KZ is to FH as MP is to [?],RH,UK,HX,HH,IY,C,4
LC_355,IW is to NQ as QO is to [?],VU,WJ,VI,LU,KT,C,4
LC_356,BZ is to HT as WX is to [?],HA,CD,DS,QD,CR,E,4
LC_357,FD is to KX as BP is to [?],VU,HK,GV,WV,GJ,E,4
LC_358,SW is to XD as PA is to [?],UH,UT,VI,WF,KT,A,4
LC_359,BJ is to HD as LB is to [?],RH,YA,SW,FH,RV,E,4
LC_360,UC is to AH as CF is to [?],IK,IA,WA,JL,HL,A,4
LC_361,UX is to HU as EO is to [?],RL,JU,RR,SM,BB,A,5
LC_362,JA is to VF as LS is to [?],ZN,XN,XX,YY,QE,C,5
LC_363,NR is to XO as WK is to [?],GH,HI,GN,MN,TU,A,5
LC_364,QH is to AP as FP is to [?],QY,PX,VH,NZ,PH,B,5
LC_365,RT is to HB as JE is to [?],TW,ZM,AN,RU,ZW,B,5
LC_366,CT is to MB as ZI is to [?],HS,PA,JQ,KR,JA,C,5
LC_367,HP is to SM as TG is to [?],QR,IJ,EJ,FE,ED,E,5
LC_368,SA is to EX as LB is to [?],IN,XY,XE,YZ,ZE,B,5
LC_369,SV is to DT as AU is to [?],LS,MT,YF,LW,PW,A,5
LC_370,KG is to AE as WT is to [?],GV,NS,UJ,MV,MR,E,5
LC_371,TM is to GJ as XF is to [?],KC,US,KI,LM,LD,A,5
LC_372,LW is to YB as PG is to [?],CL,DM,CB,UJ,UT,A,5
LC_373,YO is to LW as RN is to [?],ZA,BT,EF,FW,EV,E,5
LC_374,OL is to BI as PL is to [?],CO,CI,MI,MY,DJ,B,5
LC_375,GX is to RU as MU is to [?],YS,JF,BX,XR,XX,D,5
LC_376,JS is to ZP as XR is to [?],NU,UH,HU,OP,NO,E,5
LC_377,CF is to OD as CD is to [?],PC,AP,OB,OF,QF,C,5
LC_378,BM is to MJ as QR is to [?],CP,BO,FU,NC,BU,B,5
LC_379,QF is to CK as UR is to [?],GW,IM,HX,GM,ZD,A,5
LC_380,NB is to ZZ as VF is to [?],HD,JH,TR,HH,IE,A,5
LC_381,LZ is to VX as LX is to [?],WW,BZ,VZ,VV,JH,D,5
LC_382,EX is to OF as HW is to [?],XO,RE,RO,SF,PG,B,5
LC_383,RI is to HF as ZX is to [?],WN,QV,JA,PA,PU,E,5
LC_384,OL is to YT as TK is to [?],DS,ET,JC,BU,DC,A,5
LC_385,EA is to RI as QN is to [?],YA,DF,DK,EW,DV,E,5
LC_386,YR is to LO as MP is to [?],JC,ZS,XX,AN,ZM,E,5
LC_387,SC is to IH as ED is to [?],JT,VJ,UY,OY,UI,E,5
LC_388,VV is to LA as AV is to [?],RB,QA,FL,KQ,QQ,B,5
LC_389,YD is to JI as CG is to [?],HR,RB,NL,NB,OM,C,5
LC_390,ZM is to KJ as EL is to [?],BW,QJ,PI,TO,PO,C,5
LC_391,JL is to VJ as TD is to [?],HF,GC,FB,RP,FF,C,5
LC_392,UB is to GG as HB is to [?],TW,MN,TG,UH,VW,C,5
LC_393,PH is to FP as PR is to [?],XH,ZJ,FZ,FJ,GA,C,5
LC_394,AZ is to QW as FP is to [?],VS,WN,PS,CF,VM,E,5
LC_395,UY is to HV as JU is to [?],GH,XS,AE,WR,WX,D,5
LC_396,KO is to VW as FY is to [?],QQ,QG,RH,UQ,NJ,B,5
LC_397,HB is to RJ as TR is to [?],EA,BB,DJ,JJ,DZ,E,5
LC_398,MR is to XZ as MV is to [?],BN,XD,XN,YE,UG,B,5
LC_399,BW is to LU as FD is to [?],VF,PB,DN,PF,QC,B,5
LC_400,UK is to EI as OV is to [?],ZU,EX,YX,MF,YT,E,5